,Type of System,Total Count,Percentage
5,"incipient, intensification, mature, decay",509,61.39927623642943
6,"incipient, intensification, mature, decay, intensification 2, mature 2, decay 2",58,6.996381182147165
8,"intensification, mature, decay",50,6.031363088057901
4,"incipient, decay, intensification, mature, decay 2",41,4.945717732207479
9,"intensification, mature, decay, intensification 2, mature 2, decay 2",36,4.342581423401689
2,"decay, intensification, mature, decay 2",26,3.1363088057901085
