,Type of System,Total Count,Percentage
2,"incipient, intensification, mature, decay",622,64.05767250257466
3,"incipient, intensification, mature, decay, intensification 2, mature 2, decay 2",59,6.07621009268795
4,"intensification, mature, decay",59,6.07621009268795
1,"incipient, decay, intensification, mature, decay 2",57,5.870236869207004
5,"intensification, mature, decay, intensification 2, mature 2, decay 2",43,4.42842430484037
0,"decay, intensification, mature, decay 2",33,3.398558187435633
